term,definition,example
NMU,"The most pathetic response anyone can give you during a text or instant message conversation.  Mostly used by immature girls that don't actually give a fuck about what you're doing...especially if they couldn't even type out something longer then a 3 letter response.  2nd in pathetic to ""lol"", people that use ""nmu"" in a serious form deserve to be forever deprived from their cell phones and computers.  If a response as pathetic as ""nmu"" is used as a response, you should not even respond in the first place.",Guy: Hey what's up??  Girl: nmu  Guy: Wow that's a fucking pathetic response  Girl: Soorrryyy I'm (insert bullshit excuse here)
NO1,Euphemism: to take a piss.       See also: number one; compare: number two.,My dog did a nº1 in your childhood tree.
NOOB,"A. INTRO  I. What is this?  II. Defining 'Noob'    B. COMMON NOOB CHARACTERISTICS  I. Noobish  II. Where to find noobs  III. Behavior of noobs  IV. Noob religion  V. More about noob habitats    C. AVOIDING NOOBS  I. Make sure you aren't one  II. Major noob avoiding strategies    ------------------------    A. INTRO    I. What is this?  This guide is designed to give you a better understanding of what a noob is, how to recognize them, some details about them, and how to avoid or get rid of them. It mostly applies to online forums, which are the main targets of migrating noobs.    II. Defining 'Noob'  Contrary to the belief of many, a noob/n00b and a newbie/newb are not the same thing. Newbs are those who are new to some task* and are very beginner at it, possibly a little overconfident about it, but they are willing to learn and fix their errors to move out of that stage. n00bs, on the other hand, know little and have no will to learn any more. They expect people to do the work for them and then expect to get praised about it, and make up a unique species of their own. It is the latter we will study in this guide so that the reader is prepared to encounter them in the wild if needed.    Noobs are often referred to as n00bs as a sign of disrespect toward them, and it's often hella funny, but I will refer to them as noobs during this reading.    * Usually the topic at hand on an internet forum.    B. COMMON NOOB CHARACTERISTICS    I. Noobish  Often, but not always, noobs will attempt to communicate in their own primitive language, known as ""n00bish."" It is a variant of the hacker language that exposes them as having little intelligence or will to learn. Here is an example of some noobish. Do not attempt to comprehend it: it cannot be discerned without professionals at hand.    stFU /../..an, i r teh r0xx0rz liek emin3m, u cna go tO EHLL OR ATLE4St help m3 wit hthIS!!111!!!!!!!1~~1!!``!! LOLLOLOLLOLOLlOoLLOlollLLl u n00b    Although you may find this unbelievably funny and/or annoying, it is best to restrain yourself and keep from talking back to them, as they are very territorial and easily angered. This will result in their attempted verbal abuse of you, possibly backed up by other noobs, because they work in packs when doing offensive tasks. It is not an easy task to learn this language because our intelligent accent will keep it from sounding quite right when spoken. You can write some simple noobish of your own, however, by slamming your face into your keyboard repeatedly.    II. Where to find n00bs  On the internet, n00bs make their colonies on forums. They migrate in waves, usually on weekends, and proceed to clog up bandwidth with stupid questions and sometimes even stupid answers. If you happen to be unfortunate enough to be on a board large enough to attract migrating noobs, there will hopefully be authority in charge who is smart enough to take extermination measures before they can make nests and larger colonies. THE BANNER HAMMER is one form of authority.    Larger colonies can result in the mutation of some into spammers. Not commercial spammers, but pointless spammers. A noob can become one of these at any point, but the larger the amount of noobs, the more chance pointless spammers will appear.    Off the internet, noobs appear anywhere the focus is on learning or discussing something specific.    III. Behavior of noobs  Since noobs are basically ignorant bastards, they have a lot in common. The most often seen characteristic is their fluency in noobish, which is why it got its own section. They will also be very self confident as if they were the absolute best at what they are in fact the worst at. Also, they are quite agressive and self-centered, and tend to laugh a lot using many L's and O's in rapid sucession (the noobish word for laughing like an ultimate retard).    It is their instinct to assemble in packs for defense, and they often attempt to organize packs that they call teams. Unfortunately for them, teams usually result in a total loss of communication and they can often begin to fight amongst each other. These teams are quite unlike those formed by non-noobs.    Noobs have difficulty reading English and cannot comprehend the idea of authority.    Therefore, they have an all-out disregard for rules, basic or not. A good way to identify a noob (bad) vs. a newb (good) is to tell them (or have an authority tell them) which rule they are unknowingly breaking. If they respond with an apology and fix it, they are probably not a noob. If they react by insulting everything around them in rapid noobish and causing general mayhem, it is because they are a noob and have had a small seizure due to their inability to understand what is happening.    IV. Noob Religion  Noobs follow a variation of the 1337 (sometimes 7331) religion, in which they worship the number in odd rituals and put altars in their forum avatars and signatures. They often call themselves 1337, which experts say is somewhat like calling themselves godly in a human language. It's best to not interfere with their religious fantasies and practices because that can lead to a noob uprising, which can turn a forum to mush in less than a week.    V. More about noob habitats  Noobs often attempt to maintain their own web pages. Some common features of these lairs are a terrible lack of content, background music, lots of pointless animated gifs, and pages that say some variation of 'tHEir isnothinG H34r yEtt LOLLOLOL!111!1!!~~~!!`! 13371337', which means 'Nothing here yet' in noobish.    They will also have large, seemingly infinite marquees of 88X31 affiliate buttons replaced with red X's scattered here and there, and possibly a hit counter showing a number less than 100. These habitats are numerous but fairly easy to avoid because only noobs link to them. So if you can identify a noob, don't go to its homepage. Simple as that.    C. AVOIDING NOOBS    I. Make sure you aren't one  Note: This section is bilingual so even noobs can make the discovery if they haven't already.    English (T4lk)-    Read the above parts of this guide carefully. If you find yourself unable to comprehend any of it but are instead beginning to think about how great you are and how awesome 'teh 1337' is, you might want to take one of the many available online quizzes to check your noobancy.    Noobish (133713371337)- Liek, u gott4 re3D teh gudieCAREFUl1y and tehn OMG LIEK I AM R0XX0RZ ya anD ify 0u turn into teh reTARDED u gota go 2 MY WEBP4GE LOLLOLOL!!111~11 ad check 4 warez n stfuu. if u r a n00b go2HELL LOLLOLOlROFLMFAO11!!!11!!!! a/s/l pos gtg n00b suxx0rz ur b0xx0rz OLOOOLOLLLL HELP HELP HELP 1337133713371337    II. Major noob avoiding strategies  The main factor in attracting migrating herds of noobs is a large, active forum. If you find one of these, look to see if it has the management to avoid noob infestation. If not, look for a small or mid-sized forum that covers the same topic so you can enjoy your time there before the noobs find it.    Another way to keep noobs from interfering with your life is to become part of the authority on one of these forums. But that's often hard to do so you'll probably be better off avoiding larger forums first off. If you do manage to become part of the authority, however, take full advantage of it and establish extermination policies so that normal people can have a nice time without noob infestations.",Noob Talk: LAlWAlwalwalWAWLAWLAWA!~!~!~!!!11!!! 1M NOtttt N0000BZ
NOWL,"To be forced to do something immediately. An extreme version of ""now.""","I want Hot Poulp, and I want it NOWL!"
NOYB,Acronym for 'None of your business'.,"Person 1: Holy shit man, how did you get so damn hench?  Person 2: NOYB, now fuck off before I shit on your cornflakes."
NP,It Means No problem,Hey Bob thanks for giving me Money  Bob: Np bro
NPC,"There are two definitions for this word (both relatively the same). First there’s npc’s in video games, those are “non-player characters” or N.P.Cs. The second definition is a person with such little originality and brain power that they are the most bland human on the planet, sorta like how most Doja Cat fans always say “Does she forget she’s famous???” Or how all Andrew Tate fan says “Common Tate w.”",“Do you have a single original thought process? You npc.”
NPC Energy,When you only talk to people if they talk to you.,Person 1: why don't you ever start conversations  Person 2: because I have npc energy
NPC Walk,A form of npc energy in which someone wanders around aimlessly until someone talks to them or they stop and repeat the cycle in an endless loop.,"She just kind of wandered around my apartment, channeling her inner npc walk."
NQT,"Acronym meaning ""Not Quite There"". A more productive response to the traditional FAIL, meant to encourage further development of something.","Matt: ""Wow! Check out my awesome new website!""  Sam: ""Looks good, but needs more work""  Matt: ""Really?""  Sam ""Yeah, it's NQT"""
NR,"A term usually used on Snapchat, meaning no replies, it is often used by 12 year old girls on Snapchat that have just broken up with their hunk of a boyfriend that they've been seeing for 2 days. It is often used when people are feeling down and do not want to talk to anyone and they've just ""had enough"" of their tough, chavvy lives. Even though it says no replies, they will most likely reply with a two page essay if you just ""pop up"" to them saying ""omg babes, you okay, stay strong bbz ilsym, tell me what's happened❤️💖😍👭🎉😰."" So really, they will reply, cause they are attention seeking shit stirrers, desperate to spread the year7 gossip about George breaking up with them because she said she doesn't like parrots or some shit like that.","George: ""omg I love parrots soooooo much but like not as much as you babeee<3""  Becky: ""ewwww parrots are  GROSSSS, but ilyt baby<3""  George: ""WHAT?! YOU DONT LIKE PARROTS?! THATS IT BECKY WE ARE THROUGH, I NEVER LIKED YOU ANYWAY!!!! AND I WAS FLIRTING WITH JULIA IN SCIENCE, I LOVE HER INSTEAD!!!!""  Becky: ""NOOO!!!! Baby you are my world and my everything, I love you so much it's unreal, remember yesterday when we facetimed each other for 4 hours? Did that mean nothing to you? I love you so much baby and I can't just lose you, you are my everything!""  George: *ignores her because he's too busy FaceTiming Julia*  Becky: *puts ""nr, not in the mood😭"" on her story*"
NRN,No Reply Necessary,"Bob, will meet you at the library today as discussed @ 3 p.m. NRN  Mary, I love your new hair color. Call me @ home, I want to know more. NRN  Your comment was right on. I wish I had posted it first. NRN  Use NRN at the end of any text message or in an email Subject line to let the recipient know that preceding text finishes the message. Use at any site where you post or reply."
NS,abbreviation that means no shade,He didn’t look that good it’s ns (no shade)
NSA,No Strings Attached,Single successful individual with no time to spend in the bars looks for NSA relationship. - craigslist
NSFL,Not Safe For Life; when something is so fucked up that even the raunchiest people would be scarred from it,Dude why would you jerk off to murder hentai? That shit is NSFL
NSFW,"NSFW is an abbreviation for words like Not Safe For Wife, Not Suitable For Work, but mostly accepted as Not Safe For Work.  It is an internet slang that is often used to describe online posts that are mainly associated with heavy nudity, sexual, heavy profanity and other things that could often link with pornography. Most of the time, NSFW is used for a fandom of some sort when people want to discuss and share the sexual and porno side of the fandom.",Check out my post for Star Wars!  Warning: NSFW!
NSISR,An open minded person. Can give advice to you. Very talkative and you will think she is a funniest person in your life. A good friend. She pretty and such a cuties. Nisrina always in a cute size a.k.a short but she is stronger than what do you expect. Lot of secret admire. She also such crazy person .,That girl made me think about nisrina.
NT,This word is very popular in online gaming nowadays.This abbrieviation simply means:    Nice try.,"In Counter-strike:  You and an opponent are left.You get shot in the face,but did a lot of damage to the opponent,almost killing him.  Teammate#1: OMG you noob!  Teammate#2: SHUT UP!nt man  You: Thank you.."
NTHING,"The New Know Nothing Party--As with their predecessors, The Know-Nothing Party (Whig Dissenters), The New Know Nothing Party will make its official debut sometime in 2018. It is currently occupied by the kind of Republicans who fly with two right wings: President Trump's ""base.""","""The GOP went too far when they let that imposter Trump run on their ticket. The Republican Party as we know it will soon suffer the same fate as the Know-Nothings. The New Know Nothings are upon us.... Abe Lincoln is so dead. Oops."""
NTS,Note To Self.  Followed by a message of something that you need to remember.,"""Note To Self: Get revenge on Eric!""  ""NTS: Get revenge on Eric!"""
NVM,nevermind,
NVR,"Noob Virgin Retard, commonly used an insult in MOBA games",What an NVR that guy was
NW,Abbreviation for No Worries.,"Yeah, it'll get sorted out, nw!"
NWO,"A rebel group that was in WCW (World Championship Wrestling). Created by Eric Bischoff, and introduced at WCW's Bash at the Beach 1996, this group wreaked havoc upon wrestlers in WCW and even took over WCW Monday Nitro LIVE on TNT(WCW's weekly show) on 12/28/97. The nWo's original members were Scott Hall, Kevin Nash and Hulk Hogan.",nWo 4 LIFE!!! (nWo catch-phrase)
Nap Queen,A hot girl who doesn't go out to party. She prefers to stay indoors watching netflix and cuddling with her boo. Napping is her preferred pastime,Jean never goes out and parties cus shes a nap queen.
Natural High,"Natural High is what happens when you feel completely whole, happy, and smile towards something that you love or love to do. It's something that you can't get enough of . It's a safe high. No harm can be done emotionally or physically with this high. It's good for you, not bad. Everyone's natural high is different. It could be a person, place, animal, hobby, career, etc. A natural high is something that gives you a complete feeling.",Example: I feel a natural high when hiking in the mountains.
Nerf,"To make worse or weaken, usually in the context of weakening something in order to balance out a game.",Why the hell did Blizzard nerf Marines' attack damage?
Net Positive,"Viv for ""pretty good""",That sex with Graham was net positive
New Money,"people who have recently acquired money and feel the need to show it off by purchasing flashy houses, cars, clothing and jewelry. Generally tacky.","I hate how new money our neighbors are, they think that it's necessary to have 5 BMW's just because they can now afford it and their 10 year old daugher has a prada bag... JUST BECAUSE..."
New Wave,"A form of rock music very popular in the 1980s.  It originated in the late 1970s and lasted until around 1992.  The sounds are very electronic, using synthesizers and other keyed instruments.","Examples of New Wave bands would be Echo and the Bunnymen, INXS, Depeche Mode, U2, Devo, and Oingo Boingo."
Next Big Thing,"An annual rock concert held in Tampa, FL. The event is organized by the radio station 97x. It is, without a doubt, the best most awesomenistic chaboomski ridiculous spectacular event ever in the Tampa Bay area.","NEXT BIG THING IS HOSTING MY CHEMICAL ROMANCE, A DAY TO REMEMBER, BLACK KEYS, CHEVELLE, SWITCHFOOT, CAGE THE ELEPHANT, THE DIRTY HEADS, FINGER ELEVEN, PAPER TONGUES, SICK PUPPIES, AGAINST ME!, AMERICAN BANG, AND NEON TREES ON DECEMBER 5TH, 2010!  Anyone who is anyone is going, unless for good reason."
Next Chapter,"A super cute video game on the Nintendo DS released in 2009 with a super depressing ending in Version 1.0. In Version 2.0., 5th Cell fixed the fucked up ending because North American kids would've been freaked out.",Why does Drawn to Life: The Next Chapter have such a sad ending??
Next Level,"Something or someone on a level above all the rest of the world. The person on the 'NEXT LEVEL' usually thinks differently from everyone, hence why he is known as NEXT LEVEL.    A thing can also be called NEXT LEVEL. Anything above average basically.",Yoo that is next level shit!!
Next Step,"a canadian show about dance that is broadcasted on english channel cbbc , if you are planning to watch it i highly recommend to watch season 1-3 because the seasons after that is kind of dull tbh. no shade tho. basically the concept of the show is that a-troupe take part in competitions like regionals, nationals and internationals. and the team just work the way and rehearse for those upcoming competitions. and in my opinion it is one of the best shows on cbbc if not the best. my favourite characters are giselle and west.",hey bert have you watched the new episode of the next step  me: um yes and it was amazing!!
Night Owl,someone who tends to stay up late into the night,Most kids these days are night owls. They sleep at wee hours of the morning and get up late in the day.
No Cap,"The use of the phrase ""no cap"" is meant to convey authenticity and truth. The phrase originated in reference to decorative gold teeth, which can be divided into two distinct varieties: permanent gold teeth (aka ""perms"") or caps (aka ""pullouts""). Whereas caps can be pulled out with ease, perms, as their name suggests, are permanent. They cannot be taken out for a job interview or court date. They are an honest and lasting expression of the owners' realness.","I would only get perms because people who wear pullouts are fake, no cap."
No Context,"February 9th is national no context message day, a day where everyone can put a message with no context into every DM and server their in on Discord.","Hey today's no context message day, you know what that means.  with that said  put thing instead of think :pensive:"
No Drama,"Everything's allright, no harm done.  No problem, No worries.","""Sorry but I ate the last slice of pizza.""  ""No drama's."""
No Pressure,"A phrase used to express when you'd like for someone to do something, but you don't want them to feel pressure to do it immediately or to feel burdened by it; rather, whenever they have the chance or if they can.  It is also used to express when you're not intending to pressure someone or to soften a request you have for someone so that it doesn't feel hard, harsh, or demanding.  It can also be used sarcastically, in an event when there really IS pressure to so something.","Hey, call me whenever you decide. No pressure."
No Shade,No offense; don't take this harshly but...,"Girl, before I accept this check Imma have to your bank to make sure it can go thru--no shade."
No Shot,"When there is absolutely no chance that something happened/or is true. The phrase first gained popularity when it was heard echoing from a shipping container somewhere in Austin, Texas. It can even be traced back to an individual named Tyler ""Dimmadomefuck"" Niknam, from whom it spread like a virus.  It is typical for people who have adapted this phrase to use it continuously to the point where it becomes frustrating. Saying ""No shot"" ad nauseam has been linked with heavy cocaine use and having sudden bald spots appear.","""I did not commit the murder, i swear!""  ""No shot, bucko! Vote him out.""  ""There should be equal treatment of men and women in this workplace.""  "" NOOO Shot!"""
No Thoughts Head Empty,"when you have encountered so flabbergasting that your brain cells have left the chat, leaving you with no thoughts, speechless.","""I've mistaken my grandma's ashes for ground black pepper.""  ""no thoughts head empty"""
Noise Cancel,When the boys of the house make a smell you don't want to hear about.,"Nose cancelling ear pugs , I don't want that smell in my nose, I'm plugging my ear holes because I can hear that smell."
Non Canon,Something not accepted by the original creator or it being a spin off,Super sayain 4(Non canon)
