term,definition,example
Egirl,"an egirl is a species of emo usually found on tiktok but commonly spends time on tumblr. can be found wearing pink eyeshadow with a large wing, little hearts under the eyes and a blushed nose. normally wearing some type of shirt from urban outfitters over a longsleeve striped shirt. commonly found doing the me!me!me! dance but has probably never seen it before.",did you see that egirl doing a ahegao face unironically??  yeah man
Emote,"A term used in MMORPG's such as World of Warcraft which describes an action your character can perform which is usually accompanied by sound and sometimes even an animation. Emotes include:     /poke   /cheer   /chicken   /moo   /dance   /insult    Also a useful way to communicate across factions in games like WoW where Alliance and Horde players speak different in-game languages such as Orcish, Darnassian, etc.","Night Elf Player #1: What the heck is this Tauren doing in Teldrassil?  Night Elf Player #2: Use the insult emote on the bitch, he can't touch you here. :P   Night Elf Player #1: /insult    ""Night Elf Player #1 thinks Tauren is the son of a motherless Ogre."""
Emotional Damage,An expression that’s usually used whenever something depressing or something hard to swallow is said by someone. It is usually used during dark humor or when someone gets roasted.,"Person: I would hit you, but that would be animal abuse  Random bystander: eMoTiOnAl dAmAgE"
Endgame,A relationship that appears to be unstoppable.,Sure they just met but they're endgame. They'll get married one day.
Energy,"A mood or aura that someone ""radiates"" while doing something. Typically, this mood is laid-back and nonchalant, though the energy type can vary. Another word for this would be vibes.","1) ""Dang, that girl just brought a 2-litre bottle of soda to school, and now she's just hangin in the back of class with her earbuds in. I wish I could channel that energy.""  2) ""Bro, I just hung out with the theatre kids, and I swear, they radiate this energy that nobody else can."""
Energy Boost,When you put a small pinch of keef into an almost-cashed bowl to give it one last green hit.,"""This bowl is almost cashed, but im not quite high enough, what should I do?""  ""Here homes, pack an energy boost up in that bitch."""
Energy Shift,"A sudden shit in the mood or aura of of any conversation ( this can be through text, call, and in person)",I could feel the energy shift between us last night hes definitely up to something.
Energy Vampire,"A person who boosts his own energy by taking energy from others by means of an argument, belittlement, criticism or other one-sided conversation.",My boss yelled at me for 15 minutes and now I feel like shit.  He is such an energy vampire
Era,"A really cute girl who is a combination of everything: sexy, beautiful, smart, successful etc.  She is a real savage who will make your life a living hell if you hurt her. If you lose her you will regret forever. She is the dream girl of every man and the last thing you want is to mess with her. She is also a great friend to anyone who knows how to treat her.",I wish i had a friend like Era
Even Keel,"When a person's emotions are under control, balanced and steady.  Keel is nautical for the underneath of a watercraft that floats on water, like a ship that's going with the flow. And, even can mean smooth, so even keeled means the person is like floating through life in a smooth and even manner","The class bullies tried to get Ben to react to their taunting, but he remained even keeled, steady and as cool as a cucumber."
Evil Eye,The act of glaring at someone with a lot of anger or hatred.,"""She must be pissed, she's been giving me the evil eye all night."""
Extra,"over the top  excessive, dramatic behavior  way too much",Robert's behavior was extra when he refused to accept Anna's apology.
Extra Credit,"An act of finishing sexual intercourse.  As the man reaches his climax, he sneezes in his partner's face.    A sneeze is said to be the equivalent of 10% of an orgasm.    The orgasm plus the sneeze is 110% of a climax, thus, extra credit.",Dude: I'm about to... ah... ah... aaahchoooo!    Ho: What the fuck was that?!?!?!?!?    Dude: Extra Credit!
Eye Roll,"Fainting and experiencing extreme pleasure activates similar pathways, as the body starts to ignore or shut down certain parts of the body to focus on pleasurable sensation. Your eye muscles lose tension (since you don't need your eyes to orgasm), so your eye naturally rolls back.",I wasn't asleep it was eye roll.
F,"A way to show the utmost form of respect during an unfortunate or tragic event. This form of flattery stems from the world of gamers. ""Press F to pay respects"" is the caption in a scene that occurs at a funeral in Call of Duty: Advanced Warfare. See oof for a less formal method of condolences.",Guy 1: bro my girlfriend dumped me for a vibrator  Guy 2: F
F2F,"in person, In actual contact (as opposed to online, from face to face)",Meet him F2F for once.
F2P,Free to play. Ussually used in games that have a free as well as a pay version or mode.,<Player1> u cant use that item in f2p  <Player2> There are better items out there
F4F,"""Follow for Follow"" An invitation to follow someone on Twitter with the assurance that the person will follow you back.",@randomtweeter: @anothertweeter F4F ?
FAAK,Falling Asleep At the Keyboard,I have to go to bed before I FAAK.
FAB,"Short for ""fabulous"". Generally used by popular teenage girls or young women who are usually part of the ""in"" crowd. Also sed frequently by socialites, etc.","""Ohmigod! Juicy's new velour mini skirts are so totally fab!"""
FAF,funny as fuck,yo dat guy is faf
FAM,a word use to describe your peoples. ones that you can trust dearly. someone you consider family,my fam wuz mad deep up in the club the other day
FAQ,"Frequently asked questions.      A selection of questions that newbies may ask, and detailed answers covering all the basics of the website.",Urbandictionary needs an faq page.
FAY,"The most beautiful girl you could ever lay your eyes on. Secretly a genius, she'll make smart comments but not make you feel dumb. Although she's clumsy, she's a real athletic star. She has the craziest stories and dreams, and she makes you laugh every time she talks. Everyone wants a Fay but no one deserves her. You're the luckiest person alive if you get a Fay in your life.",Omg she's so CUTE. Such a Fay...
FB,"Fuck Buddy. A person who are having casual  sex with on a regular basis, but are not involved in a romantic relationship with.","We aren't a couple, she's just my fb."
FBB,Female body builder,I'm in fbb porn.
FBC,"FuckBoyClique  The most exclusive group of fuckboys in the world, you gotta be the best of the fucking best to get in and you can’t call yourself a fuckboy but deep down you know what the fuck you are. FuckBoyClique members must never betray another member and bitches are share between the members.","Dawg I fucked 3 bitches, fbc!"
FBF,"Flash Back Friday.  Typically used on a social media site, as a hashtag.",#FBF
FBM,Feels Bad Man. Used whenever something is done or said and makes you feel embarrassed and/or feeling bad about something.,Example: When a foreigner who doesn't speak English can spell better than you can. fbm
FBO,"When referring to automobiles, this means ""full bolt on's"". Basically the engine has had bolt on modifications and possible tuning, but no major internal changes.",My buddie's FBO mustang ran 11's last night at the track. Unfortunately he hit some people in the crowd when leaving though.
FBOW,for better or worse.,"...to have and to hold from this day forward, fbow, for richer or poorer, in sickness and in health..."
FC,"A term originaly used by Dance Dance Revolution players, meaning to ""full combo"" a difficult section, or the entire thing by not missing a single step. Recently, the term has been used by Guitar Hero players when they complete a difficult section in a song or a completely full combo the song by not missing a single note in the section or song.",Dance Dance Revolution fc  bystander: look at that crazy fat kid! he isnt missing a single step!    Guitar Hero fc  bystander: look at that PriestMLH! he isnt missing a single note!
FCOL,"Stands for ""For Crying Out Loud"", The original phrase being popularized by the television show Stargate. Common to online first-person shooters. Intended to parody other acronyms such as FFS.","InternetNitwit1: ""FFS, leran to play ur class noob!""  OtherPlayer:""FCOL""."
FEITCTAJ,"Originated around the early 80's.  Acronym for ""Fuck 'Em If They Can't Take A Joke"".",The stupid idiot didn't care for my joke.  FEITCTAJ!
FF,"FF means many things, some already said, I might (most likely will) repeat.  #1. Fist fucking- the act of stuffing a fist up a pussy *owch*  #2. Foot fucking- a type of masturbation that women do to their male partners dick.  #3. Final fantasy- a game played by geeks, such as my boyfriend, that I should probably learn to play.  #4. Fan Fiction- a type of writing that uses already made characters from books and movies and such that have sex, also called slash... gay LOTR ones at www.libraryofmoria.com.  #5. Father fucker- a person who likes to fuck their dad/friend's dad.  #6. Fucking freak- ... me...",I think I've made myself clear.
FFA,"Abbreviation of Free For All in FPS games.  One kind of game type that in a map(arena), the purpose is trying to get more frags(kills) as many as you can.","though FFA rocks, but i like CTF more"
FFS,"Acronym for, for fuck's sake.",
FICCL,"Frankly, I Couldn't Care Less","You""Hey i heard u fucked the teacher""? Me:""Frankly, I Couldn't Care Less(FICCL)"""
FIF,"Fif: means to plead the fifth amendment; to not tell something to someone else because of whatever circumstances.    In the superlative, fif can be written as ""fizzif""","Example 1: Rick: ""Tell me what happened last night with that hot chick!'  James: ""fif""    Example 2: ""I plead the fif!""    Example 3: ""I can tell you that I plead the fizzif"""
FIIK,fucked if i know,
FIIOOH,Forget it. I'm out of here,"Tomfan said:""I am sorry about that."" I said:""FIIOOH"""
FIL,Its Father In Law ... Simple typo replacement is FIL,My FIl is the best Father in law in this world ... :)
FIMH,Forever In My Heart. Said to somebody you want to say I love you too but you’re not in the position to do so.,You will be FIMH
FISH,A fish is an animal that lives underwater that looks like my good friend Newman. Newman looks like a fish and unfortunately may look like one forever. Please give hope to Newman by liking this definition as it is very accurate.,Newman looks like a fish.
FITB,Fire In The Bowl  Used in online conversation when someone is about to (or in the middle of) smoking a bowl.  also- FITMB and FITFB can mean Fire In The Mother-Fucking Bowl and Fire In The Fucking Bowl respectively.,(during online chat)  Guest 1234: FITB  User6734: Nice! i'll have a joint soon.  User487: wish i was getting high too..  User8936: bout to smoke a bowl too
FML,"means Fix My Lighthouse. Back in the 17th Century, lighthouse keepers were tthe butt of everyone's jokes. When a lighthouse keeper was made fun of, his retort would be ""why dont you fix my lighthouse!"" which was shortened over time to FML. This term was made famous in the great battle of the Sole Bay in 1902 where 14 peolpe died and 1 person broke their glasses.","""if you are going to take the piss out of me then why don't you FML!"
FOAD,An acronym for: Fuck Off And Die.,"Hey Bob, if you're not too busy, why don't you foad."
FOAF,Friend  Of  A  Friend    The way all good stories start ;),"I heard from a FOAF that there's these twins named Lemonjello and Orangejello.    Yeah, this pharmacist I know fills their prescriptions."
FOMC,(US GOVERNMENT) Federal Open Market Committee; a committee whose members include the 7 governors of the Federal Reserve Board plus five presidents of the Federal Reverse Banks (there are 12 district banks). The FOMC is responsible for open market operations of the Federal Reserve System.,The FOMC manages purchases and sales of Treasury securities.
FOMCL,short for   Fell Off My Chair Laughing,"dude: ""im gay""  dude2: ""FOMCL!"""
FOMO,"| fōmō |  noun  a state of mental or emotional strain caused by the fear of missing out.  • Evolutionary biology - an omnipresent anxiety brought on by our cognitive ability to recognize potential opportunities: The brothers had last-slice fomo as they stared at what was left of pizza.  • (with subject) desire to do something, typically accompanied by unease.  • A form of social anxiety - a compulsive concern that one might miss an opportunity or satisfying event, often aroused by posts seen on social media websites.  ORIGIN: acronym from FEAR OF MISSING OUT",The college student had concert fomo.
FRT,"for real though.  as in the statement used typically in colloquial language that implies one is not joking or is beging relatively serious about their statement, which might typically be seen as exaggeration.",FRT i have to go to that one direction concert!  If I don't get to go to that one direction concert I will slice all you mother fuckers. FRT.
FTBOMH,"FTBOMH is an acronym meaning ""From the bottom of my heart"".",Everything I tell you is FTBOMH
FTFY,"Acronym for ""fixed that for you.""  Often used sarcastically - not to fix an honest mistake, but to sarcastically disagree with someone.","Person A:  ""One Direction is awesome.""  Person B:  ""One Direction is terrible. <-- FTFY."""
FTL,"The opposite of FTW (For the Win)  An acronym for ""For the Loss""    You say it when your team is about to lose, because you got paired with grab-asses.","""People who think FTL means ""For the Lose"" are taking english tests FTL"""
FTW,"FTW is an abbreviation used for many different meanings within different groups of people: 1. Online gamers: ""for the win"". 2. Bikers/Old Jailbirds: ""fuck the world"" or ""forever two wheels"". 3. Texters/Online kids: ""fuck the what"" which is what the fuck backwards. 4. Nazis/White Supremacists: ""forever truly white"". 5. Animal activists: ""free the whales"". 6. Stoners/Potheads: ""free the weed"". 7. Eastcoast/Eastsiders: ""fuck the west/west side/ west coast""....an jus randomly: ""fuck that whore"", ""forget the worst"" ""forget the war""....etc",FTW can pretty much mean almost anything depending on the person!
FU,short for f**k you.,"""Man, I just embarrassed you!""  ""FU"""
FUBAR,fucked up beyond all repair (or recognition),The guy has been 'cage fighting' for the last decade! Its little wonder his face is FUBAR! His mother probably has to sniff him to recognize him as her baby!
FUBB,"Fucked Up Beyond Belief, Military slang, stronger than SNAFU.",Situation there's FUBB ( any  G.I. sent in Iraq)
FUD,"FUD is an acronym for ""Fear, Uncertainty, Doubt"" and is commonly used in the cryptocurrency community as a short way to describe negative information about a blockchain based currency or asset.",Stop spreading FUD about Bitcoin.
FUTAB,"Acronym for ""Feet Up, Take a Break.""","Hey, it's Friday! Chill! FUTAB!"
FW,"Fuck with, meaning associate with or take part in.","I don't fw him anymore  or  Nah, I don't fw her music, it's just not what I'm into."
FWB,"Friends with benefits, like sending nudes to each other, down to fuck with out relationship commitment",Down to be FWB
FWIW,"""For what it's worth.""","FWIW, the Supra was the best sports car Toyota ever made."
FWM,Means fuck With me in other words talk to me or go with me,"""hey lil Shorty fwm"""
FWP,First world problems. Problems that only happen to people who reside in the first world.,"My GPS ran out of batteries and I misplaced the Ambien, I have FWP."
FYA,Fuck You All    Coined by the strong against the weak. Especially when in discussion with mates.,Im right   Your all Wrong    Fuck You All !!
FYE,Fire. Usually used to compliment something.,"""He hit the folks, & it was fye as fuck!"""
FYEO,Acronym. For Your Eyes Only  Not meant to be shared.,The email I sent is FYEO so don't show it to anyone.
FYI,For your information,"FYI, today is Carol's birthday"
Face Card,"Popularized on Tik Tok and other social media, ""face card"" is used to refer to a person's facial attractiveness. Mainly used to refer to a woman's beauty.","Ella may not have a huge ass or rack, but her face card is always valid. She's stunning.  I got into the club because of my face card."
Face Reveal,When a person on YouTube shows their face for the first time ever,Leafyishere did a face reveal in August of 2015
FaceTime,oral sex.,"You fucked?"" ""Nah, we just FaceTimed."
Facepalm,"• . . . . . .. . . . . . . . . . . ,.-‘”. . . . . . . . . .``~.,  . . . . . . . .. . . . . .,.-”. . . . . . . . . . . . . . . . . .“-.,  . . . . .. . . . . . ..,/. . . . . . . . . . . . . . . . . . . . . . . ”:,  . . . . . . . .. .,?. . . . . . . . . . . . . . . . . . . . . . . . . . .\,  . . . . . . . . . /. . . . . . . . . . . . . . . . . . . . . . . . . . . . ,}  . . . . . . . . ./. . . . . . . . . . . . . . . . . . . . . . . . . . ,:`^`.}  . . . . . . . ./. . . . . . . . . . . . . . . . . . . . . . . . . ,:”. . . ./  . . . . . . .?. . . __. . . . . . . . . . . . . . . . . . . . :`. . . ./  . . . . . . . /__.(. . .“~-,_. . . . . . . . . . . . . . ,:`. . . .. ./  . . . . . . /(_. . ”~,_. . . ..“~,_. . . . . . . . . .,:`. . . . _/  . . . .. .{.._$;_. . .”=,_. . . .“-,_. . . ,.-~-,}, .~”; /. .. .}  . . .. . .((. . .*~_. . . .”=-._. . .“;,,./`. . /” . . . ./. .. ../  . . . .. . .\`~,. . ..“~.,. . . . . . . . . ..`. . .}. . . . . . ../  . . . . . .(. ..`=-,,. . . .`. . . . . . . . . . . ..(. . . ;_,,-”  . . . . . ../.`~,. . ..`-.. . . . . . . . . . . . . . ..\. . /\  . . . . . . \`~.*-,. . . . . . . . . . . . . . . . . ..|,./.....\,__  ,,_. . . . . }.>-._\. . . . . . . . . . . . . . . . . .|. . . . . . ..`=~-,  . .. `=~-,_\_. . . `\,. . . . . . . . . . . . . . . . .\  . . . . . . . . . .`=~-,,.\,. . . . . . . . . . . . . . . .\  . . . . . . . . . . . . . . . . `:,, . . . . . . . . . . . . . `\. . . . . . ..__  . . . . . . . . . . . . . . . . . . .`=-,. . . . . . . . . .,%`>--","Random stupid question  Reply:  • . . . . . .. . . . . . . . . . . ,.-‘”. . . . . . . . . .``~.,  . . . . . . . .. . . . . .,.-”. . . . . . . . . . . . . . . . . .“-.,  . . . . .. . . . . . ..,/. . . . . . . .facepalm.... . . . . . ”:,  . . . . . . . .. .,?. . . . . . . . . . . . . . . . . . . . . . . . . . .\,  . . . . . . . . . /. . . . . . . . . . . . . . . . . . . . . . . . . . . . ,}  . . . . . . . . ./. . . . . . . . . . . . . . . . . . . . . . . . . . ,:`^`.}  . . . . . . . ./. . . . . . . . . . . . . . . . . . . . . . . . . ,:”. . . ./  . . . . . . .?. . . __. . . . . . . . . . . . . . . . . . . . :`. . . ./  . . . . . . . /__.(. . .“~-,_. . . . . . . . . . . . . . ,:`. . . .. ./  . . . . . . /(_. . ”~,_. . . ..“~,_. . . . . . . . . .,:`. . . . _/  . . . .. .{.._$;_. . .”=,_. . . .“-,_. . . ,.-~-,}, .~”; /. .. .}  . . .. . .((. . .*~_. . . .”=-._. . .“;,,./`. . /” . . . ./. .. ../  . . . .. . .\`~,. . ..“~.,. . . . . . . . . ..`. . .}. . . . . . ../  . . . . . .(. ..`=-,,. . . .`. . . . . . . . . . . ..(. . . ;_,,-”  . . . . . ../.`~,. . ..`-.. . . . . . . . . . . . . . ..\. . /\  . . . . . . \`~.*-,. . . . . . . . . . . . . . . . . ..|,./.....\,__  ,,_. . . . . }.>-._\. . . . . . . . . . . . . . . . . .|. . . . . . ..`=~-,  . .. `=~-,_\_. . . `\,. . . . . . . . . . . . . . . . .\  . . . . . . . . . .`=~-,,.\,. . . . . . . . . . . . . . . .\  . . . . . . . . . . . . . . . . `:,, . . . . . . . . . . . . . `\. . . . . . ..__  . . . . . . . . . . . . . . . . . . .`=-,. . . . . . . . . .,%`>--"
Facts,"A term that originated in New York that is used to agree with something, someone, or a statement. It can also be used to point out something as being factual.","""Yo deadass nigga if anyone scuffs my timbs they finna get stomped on bruh.""  ""Yo that's facts my guy.""  ""FACTS B THAT'S ALL I SPEAK!"""
Fairycore,"An aesthetic surrounding the theme of nature, soft pastels, butterflies, magic, flowers, soft animals like bunnies, and the vibe of springtime. The visuals are very similar to cottagecore. The fashion includes lacy clothing, bows, ribbons, shiny makeup/ clothes, and pastel colors. Like cottagecore this aesthetic is based around nature.",Her aesthetic is definitely fairycore
Fake Deep,"'fake deep' is a description equivalent to an overt chauvinistic person. They appear 'smart,' 'educated,' or 'woke' upon first impression but the underlying meanings of their words contradict intent.","""I'm tired of these fake deep people trying to tell people how to live their lives and thinking they have all the answers.""  ""I hate those fake deep men complimenting / praising women while subliminally laying out rules by which they should look, feel, and act.""  ""Fake deeps shift stereotypes and simultaneously dehumanize marginalized groups."""
Fake Friend,"Someone who ignores you when they're around more 'popular' people.  Someone who only talks to you when they need something.  Someone who ignores you when they're in a group of people.  Someone who tells you they can't hangout, but they hangout with someone else instead.  Someone who never invites you to anything, unless they can't find anyone else to go.  Someone who, without a reason, gossip about you and make fun of you, but say that it was just a joke.  Someone who doesn't answer your texts when you ask them important questions.  Someone who fake laughs when they talk to you.  Someone who tells secrets to another friend, but doesn't tell them to you.  Most of all, someone who does these things, but then when it's just you two, they pretend like nothing's changed. Then they want you to act the same around them, and whether they realize what they do or not, they won't apologize.  If 4 or more of these things apply to one of your 'friends' then they are a fake friend","Real friend: hey you seem down lately, what's up?  You: nothing, just that she always ignores me around other people.  Real friend: What a bitch...don't worry about it. She's a fake friend.  You: You think?  Real friend: for sure. Look it up on urban dictionary if you don't believe me."
Fam,a word use to describe your peoples. ones that you can trust dearly. someone you consider family,my fam wuz mad deep up in the club the other day
Fan Edit,"An edit or video with music featuring a celebrity or an idol. These types of videos are usually made on apps such as Alight Motion , Videostar , After Effects , Funimate , Inshot, Cute Cut Pro, etc.","person 1: “omg did you see their Fan edits?”  person 2: “yeah, it was so cool”"
Fast Fashion,The increasingly high turnover rate of cheaply-manufactured versions of high-end designer trends.,Forever 21 and H & M are the super stars of the fast fashion world. Some one who shops at these stores is addicted to fast fashion.
Fast Forward,"To overdose on drugs and go into a coma, essentially fast forwarding time",My friend is about to fast forward. He took too much nyquil.
Fast Lane,a wealthy and stylish pace and quality of life that emphasizes quick and precise response to competition,Life in the fast lane is believed to limit room for healthy eating.
Fast Track,A group of neeks in a class who go to The Hollyfield School. Often in the bottom group for P.E and enjoy maths. It is very rare for them to have more than a handfull of friends of which are also in fast track.,"Guy 1: Are you in Fast Track?  Guy 2: Yes, why?  Guy 1: No wonder your such a neek."
Fax No Printer,Basically saying that its all truth no bs,Bro he's is hot fax no printer
Feature Drop,"A double feature dropkick is a powerful dropkick including a running start. A double feature dropkick includes both feet being firmly planted somewhere on the victims body. The chest is a popular and effective area to be targeted.  It is often shortened to ""double-feature""","The boxer was winning the fight at first, so the other kid backed off and sent a double feature dropkick the boxers way."
Feelsbadman,Ice Poseidon is not a virgin Cx,fucking normies reeeeeeee feelsbadman
Feelsbatman,Batman is sad cause his parents died so when we feel sad or bad we share emotions with batman,Me: omg lol feels it lost my phone last night.  Billy: feels batman
Feral,A word that basically means you went insane and acted like a feral animal might.,"""OH MY GOD!!! EMILY'S GOING FUCKING FERAL SOMEONE GET THE SPRAY BOTTLE!"""
Ffs,"Acronym for, for fuck's sake.",
Filter Bubble,Nationalism which excludes everyone who doesn't share your interests on the Internet. Cultural inflection that is the genesis point alt-right,Filter bubble nationalism has the world ready for Trump v. Kim Jong Un.
Filter Face,"The expression you get when you inhale the very last tobacco in your filter cigarette. The red-glowing tobacco usually causes the filter to heat up instantly, transfering painful heat to your lips.","Can also be used in a negative term to offend someone:    ""Jonnern has a permanent filter face"".  ""If I had a filter face like yours, I'd kill myself."""
Final Boss,"The last boss of any video game. One of the most if not the most climactic fight in the game.    Usually the most difficult as well, but in some games this is not necessarily the case.","Technically, Sephiroth is the final boss of FF7, but because it's a staged fight many consider Safer Sephiroth to be the final boss.    Ganon at the end of LoZ: OoT was weak.  A Stalfos is harder than him.    Halo didn't need a final boss. An all-out Covenant assault would have done the trick. But nooo, Bungie had to throw in that albino... thing."
