term,definition,example
*s*,"*S* aka salute, is commonly used throughout the gaming clans, usually in Counter-Strike. it is a form of greetings to the members of the clan.",*DEAD* harry: *S* james  *DEAD* james: *S*
*w*,an emoticon that people use even though no one knows what it means.,i like chocolate *W*
0.02,"Number 0.0202 is the best number in the world. People that have number 0.0202 as there fav number. They are the luckiest person in the world, beacuse nobody has that number. And beacuse you are strong and very fucking cool",Person: Whats youre fav number  your pov: its 0.0202  Person: Weirdo!!!!!  You know that you are the coolest person in the world
10M,"The greatest pistol cartridge ever created; the only practically sized round to ever combine high speed, penetration, accuracy and stopping power.  Has the same projectile as the .40S&W, but more powder gives higher performance.",The GLOCK model 20 chambered for the 10mm auto is a perfect 10.
10Q,thank you,thank you
10X,"ten + x = thanks    used mainly by aol ""hacker"" types and cs kids",<1337k1d> 10x m8 gg  <Anonymous> die please
121,one on one,"as in ""one on one talk"" or ""heart to heart""...oooohhhh, bet you didn't know that"
1337,"Hacker ""Sp33k"" for leet, or elite. Originating from 31337 ""eleet"", the UDP port used by Dead Cow Cult, a hacker group, to access Windows 95 using Back Orifice, a notorious hacking program.",1337 h4x0rz pwn j00!
143,1 4 3 indicates the number of letters in the words I love you,You're my best friend. 143.
1432,i love you 2,
182,How many times Al Pacino said fuck in Scarface. The reason Blink 182 put that in their name.,Oh I finally get blink 182
19,"Deep Thought the computer made a huge mistake on the answer to Life, the Universe, and Everything. Turns out the answer is 19, not 42!  This horrendous mistake was noticed when mathematicians proved that the answer to Life, the Universe, and Everything must be a prime number, which 42 isn't. As is well known, mathematical proofs, unlike scientific ones, can never be refuted. Ergo, it must be the case that Deep Thought made an error.  It turns out some craphead programmer made a (serious) typo on the very first line of Deep Thought's code, for some reason causing the whole program to add 23 to the final answer. Only God knows what the heck when in that programmer's head at the time...","Jack: 19 year-olds are the ultimate members of society since 19 is (the true) answer to Life, the Universe, and Everything.  John: I bet your 20th birthday will be the worst one yet!"
1CE,"A simplified version of ""once"" typically used online for text messaging. It combines the pronunciation of the number 1 and ""ce"" to create the sound of ""once.""","Try it at least 1ce, it won't hurt."
1NAM,1named has shit gd opinions and thinks wave is muscle memory based (it isnt dumbass) but hes a sexy motherfucker. he also have many fetishes about eeveelution r34,person 1: hey that guy looks like a 1named he must have shit opinions  person 2: yeah i agree no one likes 1named
1UP,An extra guy. You'll need a lot of these if you suck at a game.,
2,It is fucking 2,I have 2 balls
20,location or current status/activity,"what's your 20, fool"
2B,The android with the nicest ass in all of fictional and real history,"2B's ass has more than 300k polygons, which is more than all of Ocarina of Time."
2EZ,too easy,thats 2ez man!
2G2BT,Too good to be true.,"Person1: That is just 2g2bt, Linsey Lohan just CANT be released from jail ALREADY.    Person2: People these days."
2MI,To much information,This is 2MI
2MOR,"Tomorrow, written in the abbreviated form typically used in text messages.",C U L8r - 2moro?
2MORO,"Tomorrow, written in the abbreviated form typically used in text messages.",C U L8r - 2moro?
2N8,Tonight,See U 2n8?
404,Error returned when a server cannot find the requested page.,"Once upon a midnight dreary, while I websurfed, weak and weary,    Over many a strange and spurious website of 'hot chicks galore',    While I clicked my fav'rite bookmark, suddenly there came a warning,    And my heart was filled with mourning, mourning for my dear amour.    ""'Tis not possible,"" I muttered, ""give me back my cheap hardcore!""    Quoth the server, ""404""."
411,"Another term used for ""information"". Hence dialing 411 for information.","Damn she's fine, I am gonna go get the 411 on her."
420,"In 1971, five high school students – Steve Capper, Dave Reddix, Jeffrey Noel, Larry Schwartz, and Mark Gravich – in San Rafael, California, calling themselves the Waldos because ""their chosen hang-out spot was a wall outside the school"", used the term in connection with a 1971 plan to search for an abandoned cannabis crop that they had learned about, based on a treasure map made by the grower. The Waldos designated the Louis Pasteur statue on the grounds of San Rafael High School as their meeting place, and 4:20 p.m. as their meeting time. The Waldos referred to this plan with the phrase ""4:20 Louis"". After several failed attempts to find the crop, the group eventually shortened their phrase to simply ""4:20"", which ultimately evolved into a code-word that the teens used to mean consuming cannabis.  Mike Edison says that Steven Hager of High Times was responsible for taking the story about the Waldos to ""mind-boggling, cult-like extremes"" and ""suppressing"" all other stories about the origin of the term. Hager wrote ""Stoner Smart or Stoner Stupid?"", in which he attributed the early spread of the phrase to Grateful Dead followers – after Reddix became a roadie for the Dead's bassist, Phil Lesh – and called for 4:20 p.m. to be the socially accepted hour of the day to consume cannabis.",Mike: See you at 420!  Steve: Word.
459,A numerical text message that means I love you.  I Love you  = ILY = 459,OMG you are my BFF. 459
4COL,"Cyber-shorthand for saying ""For Crying Out Loud""",Randog502: I slept with your wife.  ElNombreEsDan659: oh 4col
4EAE,For ever and ever.,I'll luv U 4EAE! <3
4EVA,Always or never ending.    Ebonics for forever. Normally in the written form.,"Corona 4eva.  Sucka pleaz, theze beatz is 4eva."
4NR,Foreigner,"Dude, there's this hot 4NR in my soc. class who's from Peru."
4SALE,"A leader among children. One who brings justice, peace, and humor to the table. A well respected, admired individual. One who is sought out for his omnipotence. One that has all the right things to say, do, and think. One that is to be revered, praised and thanked.","""I don't always play Gunz, but when I do, I prefer 4saken""."
511,Someone who knows everything. They interrupt you and finish your sentences with something they've done better.,That bitch is a 511 cause she knows more then 411.  Have a question? Go ask Penny. She's the 511 cause she knows more then Information.
555,"the equvilant of ""hahaha"" in english used by thai ppl online.  In Thai ""ha"" means 5. Thus, hahaha = 555",Thai Person 1: hey ::insert a funny joke::  Thai Person 2: 555555
55555,55555 is thai internet slang for hahahahaha  5 is ha in thai so 55555 is hahahahaha,oh wow 55555
6Y,"an abbreviation for ""sexy"" because sixy sounds like sexy",im gonna be a 6y guy model when i grow up
7K,Sick; really cool,"Dude, that skateboard is so 7k"
81,8=H 1=A or HA Hells Angels,hes an 81
831,i love u... get it?   8 letters  3 words  1 meaning,"""shout out to scott! 831 babe!"""
86,"To remove, end usage, or take something out or away.  Despite ALL other posts suggestion the origion of this phrase there is only one true answer:    Chumley's, a famous and OLD New York speakeasy, is located at 86 Bedford St.  During Prohibition, an enterance through an interior adjoing courtyard was used, as it provided privacy and discretion for customers.      As was (and is) a New York tradition, the cops were on the payroll of the bar and would give a ring to the bar that they were coming for a raid.  The bartender would then give the command ""86 everybody!"", which meant that everyone should hightail it out the 86 Bedford enterance because the cops were coming in through the courtyard door.","""86 that light""    ""Everyone in Sales got 86'd."
88,"Nazi skinhead code for Heil Hitler. H being the 8th letter of the alphabet, therefore HH=88.","Usually seen in tattoos, grafitti, or as a trailer in written correspondence."
9,Cirno,⑨. Baka
;S,Someone whom you have no relation to in genealogy. A joke in the movie Spaceballs,"""I am your father's brother's nephew's cousin's former roommate""  ""And that makes us?""  ""Absolutely nothing! Which you are about to become!""  (Quote from Spaceballs)"
</3,broken hearted,guy- i <3 u  girl- screw u  guy- </3
<3,A symbol for a heart. Usually used when you type it in the space bar of the computer because you are lonely. Or used when texting that special someone. ; ) .... or when texting your mom because again you're lonely... or just really love your mom... or your mom is cool enough to understand internet slang... ANYWAY <3 means heart,"You; ""Hey babe <3""  Also you; ""Wait I'm lonely, OKAY NEVER MIND"""
<3333,"Used to show that something (placed to the left of the less-than sign) is less than 3333. Sometimes used by female/homosexual male internetters to mean ""Much Love"" or ""Four-times the love"", a play off of the symbol ""<3"". However, they are incorrect, and merely stating that the person to left left of the less-than sign is less than 3333.","CORRECT USE    Girl: 3332 <3333    in this case, the number 3332 is less than 3333.    INCORRECT USE    Girl: Andy <3333    In this case, Andy is a person and cannot be less than 3333."
?,The ultimate response to anything in text.,"Person 1: Hello!  Person 2: ?  Person 1: Hi, I'm new here.  Person 2: ?  Person 1: What?  Person 2: ?  Person 1: Okay?  Person 2: ?  Person 1: ..........  Person 2: ?  Person 1: I don't understand.....  Person 2: ?  And so on...."
?4U,"""for you"";  used mainly over the internet, im, sms, etc.",i shall be waiting 4u in the club
@ me,when you are subtweeted/subbed on social media.  used to tell someone to tag you next time.,"Billy: You don't have to be a shady shit, @ me next time!"
@TEOTD,At the end of the day,Aye bruh are we gonna hit now or @TEOTD
A/N,Author's note.  Used in fanfiction when the author wants to say something about the story,"A/N:  I wrote this at 4 in the morning, so excuse the bad spelling"
A/S/L,"Age / Sex / Location.  The mating call of the barely post-pubescant teenager.  Typically the male initiates this signal, as an attempt to attract a female that can give an honest reply to his liking.  More often, however, the male is fooled by another male, generally much older, who will impersonate his ""dream girl"" for his own sick, sadistic pleasure.","Horny teenager: ""A/S/L?""  50yr old bald, obese guy sitting naked at computer, scratching double chin and eating cheetos: ""16/F/hopefully in your bedroom soon ;) ""  Horny Teenager: ""Wanna cyber?!?!""  50yr old dude: ""Thought you'd never ask!!!!!"""
A3,"anywhere, any time, any place",i would love to catch up with you a3
AA,"The place to go if you have ever: pissed your pants; wrecked your car; been arested for multiple DUI's; passed out outdoors; urinated in an interior corner or plant; hid beer for ""later""; drank alcohol you think is foul because there is nothing else; thought hair of the dog is a good idea; lost a weekend; called up your friends to piece together why you are home without your pants; missed Thanksgiving or Christmas dinner by accident; been fired 'cause you are too drunk/hungover to got to work; woke up wondering who is sleeping next to you; intend to drink a cocktail and ended up drunk, and; you sincerely cannot stop drinking but don't want to live a miserable life.",Dude...ever since Mike's gone to AA I can keep my beer in the fridge and I don't have to worry about him watering the ficus tree.
AAF,As a friend,Love you AAF
AAK,Asleep At Keyboard. Based on the initialism AFK (away from keyboard). Generally used in the context of people who would rather chat and play MMORPGs than get a good night's sleep (and end up with neither). Not advised with webcams or IRL... or OL (...or offline).    Can also mean Actually At Keyboard.,"1: And I thought screw it that's it there's no point.  2: (zzz...)  1: well? ... hello?  2: ... huh? ... uh sorry I was out of it.  1: AAK again...    ---    I have a keyboard pattern embedded into my forehead, waffle iron style."
AAMOF,As A Matter Of Fact,"A: Did you see Matrix:Revolutions yet?  B: Yes, AAMOF, I saw it the day it came out."
AAMOI,SRK is globally known as Aamirs Dog.  Salman Khan bought this dog from Delhi & gifted to Aamir Khan. Aamir rejected Darr & Salman rejected Baazigar for their favorite dog SRK & thats how SRK became world famous dog,"Google ""Shahrukh mere pair chaat raha hai"" you will find aamirs dog"
AAP,"Androgyny Attracted Person (AAP) is someone most attracted to androgynous people, regardless of their sex or gender identity. This attraction includes feminine men such as femboys and masculine women such as tomboys. An AAP will likely dislike women who dress in a feminine way, use makeup or shave, while they also will dislike hairy or bearded men with strong masculine features body and face wise. One's attraction towards androgyny may only be a matter of looks, but usually also reflects to their personality, for this reason an AAP will likely loose sexual and romantic interest from too feminine behaviour presented by a woman and too masculine presented by a man.  While they most likely enjoy girls that look like boys and act boyish or ""butch"" and will also like boys that dress like girls and act girly or ""faggy"".","You should totally talk to him! He is not gay or straight but loves boys like you. He is an AAP, he will love your long shiny hair and will dream of your cute face!  or  - She looks like a boy! Dude are you gay?  - No, I am an AAP, I only like boyish girls like her."
AAR,After Action Report,"Check out this Warhammer AAR, it's hilarious!"
AAS,"Arnold Air Society, AKA Biggest asshole douches in the world!!  They suck so much cock, their faces look like eggs.  The only reason they get anywhere is by sucking cock.","Dude, all you do is kiss ass and suck dick.  You must be in AAS... yup there's the cord."
AASHTA,A city in Ohio known for being more worthless than a pile of shit.,"Ew, no way are we going to Ashtabula."
AATK,Always At The Keyboard,Washik: Bro you there?? or are you AFK?  Raiyan: I am AATK
ABBR,"Abbr. is the abbreviation of ""abbreviation"".    -    Types of abbreviations:    There are four main kinds of abbreviations: shortenings, contractions, initialisms, and acronyms. 1 Shortenings of words usually consist of the first few letters of the full form and are usually spelled with a final period when they are still regarded as abbreviations, for example, cont. = continued, in = inch. In the cases when they form words in their own right, the period is omitted, for example, hippo = hippopotamus, limo = limousine. Such shortenings are often but not always informal. Some become the standard forms, and the full forms are then regarded as formal or technical, for example, bus = omnibus, taxi = taxicab, deli = delicatessen, zoo = zoological garden. Sometimes shortenings are altered to facilitate their pronunciation or spelling: bike = bicycle2 Contractions are abbreviated forms in which letters from the middle of the full form have been omitted, for example, Dr. = doctor, St. = saint or street. Such forms are invariably followed by a period. Another kind of contraction is the type with an apostrophe marking the omission of letters: can't = cannot, didn't = did not, you've = you have. 3 Initialisms are made up of the initial letters of words and are pronounced as separate letters: CIA (or C.I.A.), NYC, pm (or p.m.), U.S. (or US). Practice varies with regard to periods, with current usage increasingly in favor of omitting them, especially when the initialism consists entirely of capital letters. 4 Acronyms are initialisms that have become words in their own right, or similar words formed from parts of several words. They are pronounced as words rather than as a series of letters, for example, AIDS, laser, scuba, UNESCO, and do not have periods. In many cases the acronym becomes the standard term and the full form is only used in explanatory contexts.",An abbr. is a shortened form of a word or phrase.
ABC,American Born Chinese,"Man, he ain't azn, he's ABC."
ABD,"""All But Dissertation"" -- someone who is working on a PhD, and has completed all requirements except the dissertation.","""I passed my prelims last week, so now I'm ABD."""
ABT,Contraction of ‘about’. Often used in social media conversation to reduce effort.,yo wtf u talkin abt he ain’t like that.
ABTA,the man whose daughter kicked kerpals dog,"hello, is abtar there?... this is kerpal... KERPAL!"
ABU,Abu means that he is great. Also Abu means that he never brakes a promise,This guy is Abu!!
AC,"AC is usually said in vine edits and it stands for ""Audio Credit""",Caption  ac: account
ACC,"British slang for ""actually""",I'm acc so happy right now.
ACD,"Adjournment in Contemplation of Dismissal. It is given with a time period, typically six months or one year. In criminal court, at least in New York, an ACD is a form of a suspended sentence, and is typically given out to low-level offenses such as smoking marijuana outside. If the judge gives a defendant a six month ACD, the charge(s) get dismissed and sealed if the person does not get in trouble with the law again within a six month period. If the person does get in trouble, the original charge can be brought up again. It does not necessarily imply guilt, however it may make more sense for an innocent person to simply accept the ACD and stay out of trouble than to pay the cost of defending oneself.","Since Joey and Jillian had no priors, the DA gave them both six-month ACDs for being caught fornicating in public. If they can keep their romance to the bedroom and avoid legal troubles for six months, the embarrassing charges will simply disappear."
ACDNT,"Person who would be an acquaintance however because they are such a cunt you cant call them an acquaintance, they are instead an acuntance.",Guy 1:You know my acuntance Steve?   Guy2:Yeah that guy is such a fuckin' cunt.
ACE,"Ace is a word to describe someone or something that is considered 'very cool'  Ace is also used as a term of sexuality (Asexual)  Ace can be a nickname or name  Ace can also be your partner (girlfriend, boyfriend, etc)  Ace is also a card from card games, the main situation where Ace is used is to describe just the number ""1"" on a card,  (e.g, an ace of spades)","1: ""That was ace!""  2: ""Are you gay?""  ""Nah, I'm ace.""  3: ""How are you doing today, Ace?""  4: ""Oh, my ace is so cute!""  5: ""I have an ace of diamonds up my sleeve!"""
ACK,"an exclamation of shock, surprise, or disappointment to be used mainly by awkward individuals","""ACK! I left my wallet at home!"""
ACPT,Advanced Copy Paste Technologies,I used ACPT to create this term paper;  They used a lot of ACPT when creating this new mobile device;
ADAD,Adult Developmental Assclown Disorder,Pay attention and quit being a fucking idiot! Do you have ADAD?
ADD,"A mental disorder affecting many Americans.  Symptoms include: becoming easily distracted, problems keeping focus in conversations, blurting out, frequent careless mistakes, avoiding tasks that require sustained mental effort (homework, studying, etc), giving effortless and undivided attention to topics the subject enjoys.    Many critics to the ADD diagnosis say patients are lazy, dumb, bored, and helpless.  These people are idiots that fail to realized diversity in our population.  They believe that because they can concentrate on tasks that need to be accomplished, everyone else can/should too.  They say that people with ADD are lazy and no one likes doing boring daily tasks.  They are right in that no one likes doing them, they are wrong in that some people simply can not focus enough to do so.      Everyone has problems.  Whether it be mental, physical, etc.  Saying a person with ADD is looking for an excuse is like saying a person with an handicap only has one for the sweet parking spot.  I will admit, many people take ADD medication for the 'high' they receive, and this is wrong.  But MANY drugs are abused, and people that truely have ADD shouldn't be punished.  More understanding should be given to people that have been DIAGNOSED with ADD.","Ahhhhh crap, I really have ADD and can't focus on a day-to-day basis without my medicine.  I have good days and bad days, but with my medicine I have continued focus.  Thank you to whoever created this medicine that allows me to function on a 'normal' level daily."
ADDY,Short for address,Dwayne: Yo you coming to that party tonight?  Simon: oh yeah bro what's the addy?
ADIH,"Intelligent, smart person but sometimes useless",Girl:you are such are so good you are probably adih
ADIP,"Adip's are one of the most genuine souls out there. They are willing to go above and beyond for people they care for, despite them not being in their best condition. They're the kind of people who would create a whole Google form just to ask and make sure that their friend has eaten that day, and would send adorable pictures of their pets out of nowhere to put a smile on their friends' faces.  Talented is an understatement when it comes to Adip. They sing, they play guitar, and even play the piano. The sky's literally the limit for them. Their voice, their damned voice, is the type that would envelop you and lull you to sleep, and they absolutely know the effect they have on others.  Adip's usually have a questionable sense of humor and an even more questionable compilation of memes stored in their gallery. They're definitely the life of the party, lighting up whichever room they decide to get into.  In conclusion, Adip's are precious, so you better be grateful if you happen to have an Adip in your life.",1. Adip's at it again today.  What did they do this time?  2. Look at this meme Adip sent. Are they high?
ADMIN,"An administrator of a computer system, an online forum etc.",Stop it or I'll email the admin!
ADMINR,astia de pe clanu mafiei hate sunteti niste terminati,accepto admine ben 10 cabral
ADN,"Frequent mispelling of the word ""and"" and therefore, possibly the most annoying word you'll ever read when going over your work. Apart from ""teh"".","""Round adn round they went... oh, FUCK IT!"""
ADR,Average Damage per Round  Often used in Counter-Strike and other FPS',"Hey what's your ADR?  It's only 13.2, I've been doing crap lately"
AE,"an editing software by adobe , short for after effects",friend :“what do you use to edit??”  person: “i use ae”
AEAP,as early as possible  an alternative to ASAP (as soon as possible),“What time are you going to the check-in?”  “Aeap”  “Nice”
AF,Stands for 'as fuck' . The SI unit of everything.,Wow! That's cool af.
AFAIAA,As Far As I Am Aware,"""Is assetSummaries currently the preferred way to search for assets from the front-end?""  ""heh dont know if its preferred afaiaa its the only way"""
AFAIC,As far as I'm concerned.,"This doesn't really need an example, AFAIC."
AFAIK,as far as i know,"""When will the page be back?""  ""afaik in 2 hours"""
AFAIUI,"Short for ""as far as I understand it""","""When will the page be back?""   ""AFAIUI, in 2 hours"""
AFAP,As Fast As Possible,"Nurse, get me some dirty magazines, AFAP."
AFC,"Average Frustrated Chump: An AFC is a man who unknowingly kills the sexual and romantic interests of a woman through the very deeds and behaviors he believes should arouse them. This ironic outcome is usually attributed to a complete imbalance of qualities in the AFC, such as the extreme willingness to listen, understand and comfort a woman, while also sharply contrasting this by a concentrated effort to avoid sexual innuendos or advances of any kind, avoiding differing opinions or interests that may insinuate any incompatibility and the avoidance of telling a woman she is behaving wrong and/or improperly, even in cases when it's clear that she is.     Other typical traits and behaviors of the AFC include but are not limited to:    ~An unprecedented ability to forgive a woman for hurtful and/or malicious acts.    ~An unusual level of trust that fails to keep gullable behavior in check.     ~The act of providing expensive or romantic gifts too readily and/or prematurely.     ~The act of performing favors even when he feels he is being taken advantage of.     ~The view that the majority of men are heartless dogs who chase women for sexual purposes only.     ~An eagerness to display his romantic, chivalrous and sensitive qualities to prove he is not like other men.     ~The act of changing who he is in an effort to impress a certain woman.","Because Johnny is such an AFC, Sally decided she didn't want to ruin her friendship with him by getting involved in a sexual relationship."
AFFA,angels forever forever angels,affa is a hells angels motorcycle club patch worn by members.
AFJ,"Abbreviation for ""Angry Fat Jew"". Commonly used to describe characters in movies where Jewish characters exhibit a resentful attitude, or to address friends in a joking manner.",He's going off about his medications again and acting like an AFJ.
AFK,"Used on online gaming, this literally means Away From Keyboard. Used to say if somebody is inactive.",I was kicked for being AFK in the game
AFPOE,The term dates back to the 16th century when our English vocabulary was still developing. The term was used up until the 17th century when it became an obsolete term. It was used to describe an excitement for educational material. One with a positive attitude can also be described as an aypoe even though it might not be directly related to education.,"Wow, what Aypoe time had!"
