term,definition,example
Soft Life,"The act of simply living a life with less stress, worry, and concern. Making better decisions that benefit your overall well-being. You don’t prioritize fitting in, following trends, your just here to live your divine purpose.","My health is more important than stressing over how much money I’ll make doing this job, I live a soft life.  I don’t care if everybody wakes up 6am to go for a jog, I want to sleep in, I live a soft life."
Soft Reset,"A quiet yet intentional restart where you realign your mindset, habits, and priorities. This is done without cutting people off, making announcements, or causing chaos. A soft reset is about choosing peace and growth over drama.","After a stressful first semester, I did a soft reset by journaling, setting new boundaries, and focusing on myself instead of explaining my changes to everyone."
Soft Skill,The ability to hold a penis in your mouth until it is soft.    This term is often thrown around in the corporate world when referring to a person's customer service skills (which are basically the same thing).,"Manager: Bob, you need to work more on your soft skills.    Worker: My name is Steve.    Manager: Sorry, I couldn't understand you with my penis in your mouth."
Soft Smile,A trendy pose where the participants can hardly be bothered with a full smile. A smile created more with ones eyes than mouth with lips closed and the corners of ones mouth just ever so slightly turnt up.,The whole squad sporting a soft smile in that snapchat. #softsmiles
Soft Spot,Soft spot is when you like a boy/girl and you'll do basically anything for them. You could be mean to anyone but when it comes to them you're the nicest person on earth. You do the most just to make them happy etc,Kelly is mad at jake  *Jake wrights her a long paragraph on how sorry he is*  Kelly: he totally has a soft spot for me
Solid Ground,BACK ON MY SQUARE!!!,"You will eventually {after a long time, especially after many problems & setbacks:} have to retrace {to go back over a path & route again; to review something in the mind such as an argument, account & series of events:} your steps to get back on solid ground !!!"
Solid Plan,to make plans that no one can back out of.,mercy: we need to make solid plans.  paige: how about tomorrow?  mercy: yeah ok but i dont wanna hear you say you cant at the last second.  paige: thats why they are going to be soild plans.
Solo Mission,When one does something alone because no one will go with them,"Victoria: ""Can you go to lunch at noon?""  Emily: ""No, sorry I have class""  Victoria: ""Damn, looks like it will be a solo mission"""
SorG,"Plastic surgery that requires a form of sorcery to be successful. Said to be particularly helpful for individuals who's face is seen on TV, such as David Pakman, the host of The David Pakman show, who was asked by a caller to get some plastic sorgery to fix his face, in order to convince the caller to watch the show more.",David Pakman could use some plastic sorgery to fix his face. I would watch The David Pakman show on YouTube more if he did.
Soulmate,"What is a soulmate?  The bond between two people. When you just understand each other and have a special connection that no other could beat. The trust they have with one another is eternal and are always there for each other forever, Infinity and beyond 🤞🏽💞",Lay lay and kray kray 🦋- the two BestFriends-like sisters-are an example of a soulmate. They have lots of things in common and are alike in many ways possible. They are the bestest BFF to each other and support each other and love creating memories together. They are always there for each other unlike some backstabbing snakes 🐍🤓👽. No other BestFriends could beat there connection💎.
Spawn Kill,Abortion,They were spawn killed
Speedrun,An event where a gamer tries to beat a game as fast as possible or to break a speedrun record.,Gamer 1: Hey dude. Have you seen the speedrun that Gamer 3 did?  Gamer 2: Yeah bro. He broke a record.
Spill,"In slang derived from stan twitter, spill comes from the root “spill the tea”, which means to tell the gossip or the truth. Spill is simply a shortened and modernized version of the now-outdated phrase.",Person 1: “Ariana’s best album is Sweetener.”  Person 2: “Spill! It’s by far her most well-produced and experimental album!”
Spill the Tea,when one tells an especially juicy bit of gossip,"""Girl, did you know Renee is having ANOTHER baby? And the babby daddy is the same guy who she found out has been cheating on her!""    ""OMG, spill the tea on that drama!!!!"""
Spin the Block,"To come back around on a block, to re-shoot at an opp (opposition), to finish the drill. Or, to add new suspects to the hit.","“Fuck da, spin the block, shoot the friend too.”- NLE Choppa"
Stable Build,".9.<.7.9.7.6.>《.7.9.7.6.》 Angel Number four hhhgjhundred and four signifies building a stable mindset and practical life to express the beforehand notion since it has the word ""'AnDaD'c<.7.9.7.6.>《.7.9.7.6.》.9.",".9.<.7.9.7.6.>《.7.9.7.6.》 Angel Number four hhhgjhundred and four signifies building a stable mindset and practical life to express the beforehand notion since it has the word ""'AnDaD'c<.7.9.7.6.>《.7.9.7.6.》.9."
Stan,"A reference to the Eminem song Stan. The song is about an overly obsessed fan (named Stan) who writes letters to eminem and ends up driving off a bridge with his pregnant wife, because Eminem didn't write him back.  The terms means a very very overzealous and obsessed fan of a celebrity/band/cast of a tvshow or movie.",Person 1: I just love Ariana Grande so much I would die for her I would track her every move if I could  Person 2: woah don't be such a stan
Stan Behavior,when someone is so obsessed over you that they'll try and stalk you or be like you,"""I just found your home address""  ""stan behavior smh"""
Standing on Business,"Short Def: Take care of your business  Long Def: When faced with a situation, you are urged to handle your own affairs.  Sad Def: After breaking up with your significant other, you are focusing on your business by dealing with your personal matters.","""Ay, Qebly what happened to your hoe?""  ""Fuck dat bih, I'm standing on business"""
Starter Pack,"Certain objects, characteristics, or actions that make up a particular type of person.","The ""How to get rich with no talent"" starter pack: camera, porn service, be Kim K  The high school starter pack: early alarms, ""what's the homework"" texts, advil"
Stay Gold,"Being true to yourself, innocent, uncorrupted, unblemished etc.       Not conforming to what society dictates, but in a sense marching to the beat of your own drummer","___________     Johnny: ""Your gold when your a kid. When your a kid, everythings new. Like dawn, the way you dig sunsets, Ponyboy, that's gold. Keep it that way, its a good way to be.""    -Liz stay gold :)"
Stay Mad,when someone hates on you or tries to knock you off your grind you say “stay mad”,yuridia - look at her hair it’s so short  valeria - yuridia you stay mad
Stay Winning,"Continue to “win” or be good at life, like it’s a game.","“Good job dude, Stay Winning.”"
Stay Woke,"Stay woke means to understand the real world and to look everything and think twice because things can change in a second, to look deep and know what to permanently take something into your life, to know everything that’s fake or sus around you and to know when to cut people off .","Two faced people all around, people need to stay woke about it ."
Step Forward,"It is a popular lyric to a song, but sometime used i phrases or as comparisons to things. it's basically taking one step back. and it means, making progress towards something but making less progress rather than more, if that makes sense.  ""one step forward < two steps back""","I was trying to finish my math homework, and i did the beginning, but going to that party before finishing was one step forward and two steps back."
Step Up,"Step up: a command that is uttered at a nigga who is either trying to get in your face or is talkin trash about you like he is the shit when you know that deep down, the nigga is a soft-ass bitch.","Latrell: ""Man, that Doug is a biscuit eatin' bitch.""    Doug: ""Oh so you have somethin' to say? why don't you step up you candy-ass trick."""
Stitch Video,"<.7.9.6.7.>The Switch Knife Mechanic Through First And Third Person View In Video Game Theory In Second Person For THe fourth Dimension, ALso Know, As, The Fourth Wall For Angel Hellstrom Jose Robles<.7.9.6.7.>","<.7.9.6.7.>The Switch Knife Mechanic Through First And Third Person View In Video Game Theory In Second Person For THe fourth Dimension, ALso Know, As, The Fourth Wall For Angel Hellstrom Jose Robles<.7.9.6.7.>"
Story Time,An unfunny dumb useless word ruining a Tik tok comment section,I don’t even want to give an example cuz it enrages me sm but story time
Straight Up,"1. Actually.  2. In all honesty, seriously.  3. Honest.","1. That guy straight up just took off his clothes in public.  2. Straight up, I'm not playing with you.  3. If he asks you where you were, be straight up, don't lie about it."
Street Cred,Commanding a level of respect in an urban environment due to experience in or knowledge of issues affecting those environments,He's been thru it all.  His street cred is undeniable.
Strong Finish,When athletic boys take to long to come cause they look at themselves in the mirror until they finish.,She walking funny because her fuck boy Justin likes to Finish Strong.
Strong Suit,The best or highest valued ability of a person. Mostly used in a negative sense to emphasise that someone is not good at a particular activity.    The phrase derives from card games where suits are considered to have different values.,Daphne: Wanna go dance?  Fred: Dancing isn't my strong suit. How about we go bowling instead?
Sturdy,The act of dancing during a lit event or at anytime,Yo my boy Mark getting sturdy to that pop smoke
Subtle Flex,"Wearing expensive attire that are not flashy, e.g. a pair of Balenciaga booties, but that are still recognizable from an exclusive brand.",Craig likes to wear designer that are not attention grabbing.  Craig likes to subtle flex.
Sunny Side,Another term for the vagina,A good day is always started with some sunny side up on the way to the butt
Supporter,a cat who does not spoil football games,my friend was a supporter- she kept the live score secret in the cro-den game
Sus,Giving the impression that something is questionable or dishonest; suspicious. This word gained popularity with being the catchphrase in the online multiplayer game among us.,"""it's a little sus that he seems to know exactly how to play this game""  ''cyan actin' sus''"
Sweaty,"Sweaty is also used to describe a person who is way into something with intensity.  Whatever the person is doing, if they are balls deep into the game then they are a sweaty fucker.",I just saw a group of 5 sweaty dudes playing guitar hero.    That sweaty fucker has a halo shirt on.    He can grind a 15 foot rail.  Hes pretty sweaty.
Sweet Spot,a spot on the body that responds pleasurably to a to a touch or caress,Rusty sighed with pleasure when his wife kissed the sweet spot on his neck
Swerve,"A word meaning ""Move, bitch."" It is an evolved form of the phrase once uttered by Ludacris: ""Move, bitch, get out the way."" It is known as the most scholarly word of the new generation.","""Oh shit. I need to use the bathroom. Swerve, bitch!"""
Switch Gears,"Verb.    1.  In an transmission (car or otherwise), the activity of changing a gear to run the system optimally.      2.  Used to describe the activity of having vaginal sex and then casually moving to anal sex.  This activity generally surprises girls!","My boyfriend switch gears on me last night and I slapped his ass.  He will not get any for a while.      Girl1 Hola chica!  Girl2 My BF swiched gears on me last night.  Girl1 How did that go???  Girl2 I was mad at first, but I got used to it.  The best part is when he nuts in my ass, I can't get pregnant!  My butt is a bit sore though."
Switch Up,Someone who changes actions or mannerisms at a moments notice with friends or associates.,Niggas will switch up that fast these days...
System Update,"A term used to trick players of RuneScape that the game is  being updated, when it really isn't, causing spam and confusion.",<Person1> SYSTEM UPDATE  <Person2> really?????  <Person3> YES finally!!  <Person4> omg new skill pl0x  <Person5> i cant see any update
S’OK,A cross between 'its' and 'ok'. When you say it fast its s'ok (sokay). Its very simple and short.,"""Oh I'm so sorry I'm late!""  ""s'ok"""
T+,"An amazing song by japanese music producer t+pazolite released 08 October 2021 from the album FAKE CIRCUS, with a strange but very entertaining video",guy 1: did you hear the song t+ vs shark? its amazing!!!  guy 2: yeah! absolute banger!
T:)T,"It's the new emoticon! It stands for look of intense studying. It's when someone is studying something intently. The lines on the top stand for eyebrows, the parenthesis stand for eyes and the | lines in between stand for the pupils. It's a serious emoticon. Mostly used by those who study a lot and/or like studying. It means they're studying.","online  Person A: How's it going?  Person B: is studying intently (T)_(T) Fine. Don't worry if I don't answer right away, I'm studying.  Person A: O.K. so what else is new?  *two minutes later  Person B: Nothing much. (T)_(T) I'm studying. Studying is fun!"
TA,"An informal way of saying ""thank you"" in the British Empire (or what's left of it). It isn't commonly used in Canada or the United States, and could be misinterpreted as ""goodbye"" (a shortening of ""ta-ta"").","When I held the door open for a girl in Australia, she said ""ta"". I thought she was being rudely dismissive, but it turns out she was just being polite."
TAFN,That's All For Now,"Internet acronym: That's All For Now, tafn"
TAM,"The best person you will ever meet. She will be the most precious person to ever enter your life. Every moment with her is memorable and full of joy. Not only is she pretty, but she also has an amazing personality. Tam does not realize how beautiful she is and will always sell herself short, so she always needs a reminder of her how beautiful and appreciated she is. She is very sensitive, delicate, tries her best not to burden others, and likes to keep her troubles to herself. All that will only make you want to become a more significant person in her life and be that person she can open up to during her darkest moments. She is easy to talk to and is comfortable to be around, which makes it easy to be yourself around her. She is the most supportive and accepting person ever. She is also artistic and creative, and will always surprise you with creative, handmade gifts.","Tam is so similar and relatable, sometimes I am convinced that she is the female version of me. Our connection is so strong that I genuinely believe she is my soul-mate.  Saranghae Tam."
TANK,"1. Any person who is exceptionally large, either in terms of height, wieght; being built.    2. Any person who is exceptionally strong.",Man! Hes a friggin' tank!
TANKED,"Flopped on billboard charts, if it even made it to the charts.  A word that stans use ALL THE TIME.",This album by this person tanked.
TANKING,"The word tanking, in terms of sport, would be used to describe a bad performance    Tanking is the act of giving up a match or ""throwing it away"", losing intentionally or not competing.",I tanked my match so bad!    She was tanking her match.    He tanked the match after losing the first set.    They tanked their match because they got angry with the referee/umpire.
TARFU,"Also stands for ""Totally And Royally Fucked Up""","In the 1944 U.S. Army animated short The Three Brothers,a character named Fubar is a brother of Private Snafu (Situation Normal, All Fucked Up) and Tarfu (Things Are Really Fucked Up, or Totally and Royally Fucked Up)"
TAU,"a race in warhammer 40k (the tabletop wargame) that is high in society and is focused on ""the greater good"" which is putting aside personal desires for the better of their society. they are all ranged. their tactics include killing the enemy at range and if the enemy swarms them they usually relocate to a better firing position. their standard weapon (the pulse rifle) has the longest range of a basic weapon in the game. they appear as humanoid creatures with 2 legs, with hooves, two arms, four fingers and about as tall as 6'0. they are the highest technological race in the game.",wOOt! my tau just pwned your orks cause they are raped by rail rifles and have a shitty 6 save.
TBAG,1. the act of placing a males ballsack inside a mouth of another  2. a bag belonging to Mr T,"1. ZOMG YOU TBAGGED HER WHEN SHE WAS DRUNK!!!  2. I found this bag with a ""list of fools pitied"" inside it, so i figured it must be a Tbag"
TBBH,to be brutally honest,You look like a fucking pig tbbh.
TBC,To Be Clear,Max - tbc I don't like you  Alex- tbc I feel the same
TBD,"Acronym for ""To Be Determined"".  Commonly used in business.","Should we close this deal or not, we're not sure yet right?  Answer: TBD"
TBH,To be honest,tbh your breath smells like shit and you should go get a breath mint
TBL,"Takut Banget Lho  This term is used for saying that you are shocked by something. This term is popularized by Bondol.JPG, an influencer in Indonesia.",TBL TBL TBL He is cheating on you?
TBT,"Originally ""throwback Thursday"" but now often used on other days. Can now stand for ""throwback to"" to indicate an old photo, thought, idea, etc. Often used in social media to reminisce, as usually social media is supposed to show the ""here/now/recently.""",#tbt the time I only drank milk  #tbt me as a cute 5 year old  #tbt corded phones
TC,"Total Compensation on an annualized, repeatable basis. Usually used in the context of compensation packages in the software industry with companies such as Google and Facebook.","Man did you hear new grad TC for Google went up to $170k? They're offering $115k base salary, $160k stocks over 4 years, 15% annual bonus and a $30k signing bonus on top of that."
TCB,Take care of business or Taking care of business.,"Yo, I gotta go TCB."
TCOY,TCOY = Take Care Of Yourself,"A: Hey, John. What’s up? You look so pale!  B: My runny nose is killing me. I’ve suffered from it for nearly a week. And I can’t barely sleep well.  A: Why don’t you go see a doctor?  B: Alright. I’ll go see a doctor immediately.  A: TCOY."
TD,Today,Are you going to the game td?  Yeah r u?
TD2M,talk dirty to me,can you please TD2M
TDTM,Talk Dirty to Me. Like the Poison song.,(Instant Message) Dude: Hey baby! TDTM!  Chich: TDTM?  Dude: Um... The... Drama... Team's...        Mostawesome... Mr. Dolan.  Chich?: How'd you guess?
TEA,"the best kind of gossip, typically shared between friends. it’s a bonding tool for people of all ages. tea is usually about someone you know, but can also extend to celebrities random internet scandals, etc.",ugh I’ve missed so much what’s the tea sis?  I heard some tea about Saturday night!  what’s the tea with them are they a couple?
TFF,too fucking funny,
TFS,"I've heard it stands for team foundation server, but having used team foundation server, I now know it stands for Total Fucking Shit.",Did you know that TFS is Total Fucking Shit.
TFTF,Thanks for the follow. (Twitter),TFTF; hope you get some good info from my Tweets!
TFTI,"an acronym for Thanks For The Invite, usually used when a bunch of your buddies go out and they dont think to invite you",Joe: Man that party we all went to was crazy as hell  John: tfti assholes
TFTT,Tweeting from the toilet.,"""Sending out this Tweet(on Twitter) while on the toilet because it couldn't wait. #TFTT"""
TFW,"That feeling when. Used to describe a particularly emotionally charged experience, whether positive or negative.",TFW you hear bae calling for you.  TFW you discover your roomie ate the last pop tart.
TG,tg meaning together,so when are getting back tg?
TGIF,"Acronym for ""Thank God it's Friday"". Used to express the joy one feels in knowing that the work week has officially ended and that they have two days off with which to enjoy.    Is also the name of a block of family friendly sitcoms aired on the ABC network every Friday evening. It was a pretty good block back during the 80's and early 90's when they showed Perfect Strangers, Full House, Family Matters, Hangin' With Mister Cooper, Step By Step, and the ORIGINAL America's Funniest Home Videos (yes, with Bob Faggot) but turned to pure shit towards the end of its more than decade-long run when it decided to run bilge like Sabrina The Teenage Witch, Sister Sister, and The Hugleys.    The lineup was cancelled a number of years back because of its aformentioned shittiness, but has been recently brought back to life due to the incessant complaining due to 80's children such as myself. Unfortunately, the new TGIF will premier with sitcoms even shittier than the ones that killed it off in the first goddamn place.    God, how I miss 80's television.","Bring back Full House! Bring back Family Matters! Bring back Perfect Strangers! Hell, bring back the original AMVs starring that unfunny fuckface Bob Saget! I want my goddamn TGIF back in its original 80's form!"
THNQ,Thnq = Thank You.,X : Can you send me that picture?  Y : Yes.  X : Thnq!
THNX,Thanks  Thank you,thnx for the information you gave me
THOT,A girl who is looked at as a hoe or slut.,That girl a thot from the block .
THT,"short abbreviation for ""that"" often used in msn, by people who just cba to type evry lettr...","person1: ""hey, do you know what froogle is?""    person2: ""whats tht?"""
THX,wen ur too lazy to spel thanks,guy 1:thx for the food friend.  guy 2:who the fuck are you and I don't have any friends.
TIA,"Tia is the most beautiful girl of the gang, she's brave and will defend her friends through everything, Tia, as I said is beautiful but doesn't admit it.  Tia always sticks with her friends and always goes for the best boys ever.  You could take one look at Tia and fall head over heels for her.  Boys, always keep a Tia because after you let her go she's not coming back to you.  Tia has many talents such as performing arts (acting, singing and dancing)  I could go on and on about Tia but I can't be assed to type any more",There's Tia with the best of all boys
TIAD,TIAD = Taste In Ass Disease. People who think any weird food combos taste good because they have their taste buds in their ass.,Seafood + Cheese = TIAD.
TIC,v. to postpone payment of drugs until a suitable date,"I arranged to meet Ronnie to buy some weed, but I didn't have any money, so he let me tic for it..."
TIL,T.I.L. (Today I Learned)  Often used as a space saver on websites such as Reddit or DIGG when writing the titles of links to interesting things the submitter has learned that day.,"TIL that a meter is the distance light travels in 299,792,458ths of a second."
TILIS,"beautiful, smart, cute, passionate, and caring girl that has a punk rocker-ish style. kind of shy but in a sexy way. gets all the guys. Hot body, and great in bed. ;) usually has really cool colored hair that looks nice.",Talissa is everything goals
TIME,"People assume that time is a strict progression of cause to effect, but actually from a non-linear, non-subjective viewpiont - its more like a big ball of . . . wibbly wobbly . . . time-y wimey . . . stuff.",Time and Relative Dimension(s) in Space  You should always waste time when you don't have any. Time is not the boss of you. Rule 408.
TIR,"TIR is an internet acronym for Today I Remembered or Today I Realized, for when you remember something from the past or have a sudden awareness of something. TIR is similar to TIL (Today I Learned) but often indicates past knowledge or exposure to the information.","TIR an awesome cartoon from my childhood.  TIR how to write the letter ""G"" in cursive... and that we never used cursive in high school."
TL,TimeLine.  it's your home page where you could see the content of your news feed.,"-nice meme, where did you get it from?  =just found it in my tl ."
TL;DR,"A) ""Too long; didn't read."", meaning a post, article, or anything with words was too long, and whoever used the phrase didn't read it for that reason.    B) Also used by someone who wrote a large posts/article/whatever to show a brief summary of their post as it might be too long.","a)   Guy One: Did you read that book for English class?    Guy two: No, tl;dr.    B)   Guy one: Cake is a form of food that is usually sweet and often baked. Cakes normally combine some kind of flour, a sweetening agent (commonly sugar), a binding agent (generally egg, though gluten or starch are often used by vegetarians and vegans), fats (usually butter, shortening, or margarine, although a fruit purée such as applesauce is sometimes substituted to avoid using fat), a liquid (milk, water or fruit juice), flavors and some form of leavening agent (such as yeast or baking powder), though many cakes lack these ingredients and instead rely on air bubbles in the dough to expand and cause the cake to rise. Cake is often frosted with buttercream or marzipan, and finished with piped borders and crystallized fruit.1    Cake is often the dessert of choice for meals at ceremonial occasions, particularly weddings, anniversaries and birthdays. There are literally millions of cake recipes (some are bread-like and some rich and elaborate) and many are centuries old. Cake making is no longer a complicated procedure; while at one time considerable labor went into cake making (particularly the whisking of egg foams), baking equipment and directions have been simplified that even the most amateur cook may bake a cake.    tl;dr: Cake is a baked, yummy sweet."
